2002-12-31, Chicago, Rob Marshall, 2002, 64,, 2002
2002-12-29, Catch Me If You Can, Steven Spielberg, 2002, 67,, 2002
2002-12-28, Dahmer, David Jacobson, 2002, 46,, 2002
2002-12-27, Heaven, Tom Tykwer, 2002, 66,, 2002
2002-12-24, 'R Xmas, Abel Ferrara, 2001, 56,, 2002
2002-12-24, Two Weeks Notice, Marc Lawrence, 2002, 47,, 2002
2002-12-23, Esther Kahn, Arnaud Desplechin, 2000, 72,, 2002
2002-12-22, Last Orders, Fred Schepisi, 2001, 57,, 2002
2002-12-22, Gangs of New York, Martin Scorsese, 2002, 63,, 2002
2002-12-21, The Lord of the Rings: The Two Towers, Peter Jackson, 2002, 72,, 2002
2002-12-21, Russian Ark, Alexander Sukorov, 2002, 69,, 2002
2002-12-19, Warm Water Under a Red Bridge, Shohei Imamura, 2001, 62,, 2002
2002-12-17, Merci pour le chocolat, Claude Chabrol, 2000, 59,, 2002
2002-12-15, I'm Going Home, Manoel de Oliveira, 2001, 63,, 2002
2002-12-14, Rebecca, Alfred Hitchcock, 1940, 84,
2002-12-13, Songs From the Second Floor, Roy Andersson, 2000, 78,, 2002
2002-12-12, Adaptation., Spike Jonze, 2002, 78,, 2002
2002-12-10, Derrida, Kirby Dick & Amy Ziering Kofman, 2002, 59,, 2002
2002-12-09, Changing Lanes, Roger Michell, 2002, 25,, 2002
2002-12-08, His Wedding Night, Roscoe Arbuckle, 1917, 56, s
2002-12-08, Undisputed, Walter Hill, 2002, 47,, 2002
2002-12-04, A.B.C. Africa, Abbas Kiarostami, 2001, 56,, 2002
2002-12-03, The Birth of Love, Philippe Garrel, 1993, 57,
2002-12-02, All About Lily Chou-Chou, Shunji Iwai, 2001, 82,, 2002
2002-12-01, The Happiness of the Katakuris, Takashi Miike, 2001, 51,, 2002
2002-11-30, Solaris, Steven Soderbergh, 2002, 72,, 2002
2002-11-24, Ménilmontant, Dimitri Kirsanoff, 1926, 64,
2002-11-22, Far From Heaven, Todd Haynes, 2002, 72,, 2002
2002-11-20, Easy Virtue, Alfred Hitchcock, 1927, 66,
2002-11-19, Pigalle, Karim Dridi, 1994, 57,
2002-11-17, Chang, Merian C. Cooper & Ernest B. Shoedsack, 1927, 64,
2002-11-17, Napoleon, Abel Gance, 1927, 54,
2002-11-16, The Truth About Charlie, Jonathan Demme, 2002, 64,, 2002
2002-11-15, 8 Mile, Curtis Hanson, 2002, 48,, 2002
2002-11-10, Frida, Julie Taymor, 2002, 44,, 2002
2002-11-10, Les Destinées, Olivier Assayas, 2000, 76,, 2002
2002-11-09, Femme Fatale, Brian De Palma, 2002, 63,, 2002
2002-11-08, Bloody Sunday, Paul Greengrass, 2002, 62,, 2002
2002-11-05, Mother, V.I. Pudovkin, 1926, 65,
2002-11-04, Dressed to Kill, Brian De Palma, 1980, 56,
2002-11-03, Bowling For Columbine, Michael Moore, 2002, 65,, 2002
2002-11-02, Ring 2, Hideo Nakata, 1998, 50,
2002-11-02, Jackass the Movie, Jeff Tremaine, 2002, 66,, 2002
2002-10-27, The Rules of Attraction, Roger Avary, 2002, 67,, 2002
2002-10-25, Secretary, Steven Shainberg, 2002, 51,, 2002
2002-10-23, Battling Butler, Buster Keaton, 1926, 58,
2002-10-22, Zvenigora, Alexander Dovzhenko, 1928, 61,
2002-10-21, 8 Women, François Ozon, 2002, 76,, 2002
2002-10-20, Spirited Away, Hayao Miyazaki, 2001, 68,, 2002
2002-10-19, Punch-Drunk Love, Paul Thomas Anderson, 2002, 71,, 2002
2002-10-18, The Ring, Gore Verbinski, 2002, 53,, 2002
2002-10-18, The Strong Man, Frank Capra, 1926, 57,
2002-10-16, The Lodger, Alfred Hitchcock, 1926, 61,
2002-10-15, By the Law, Lev Kuleshov, 1926, 60,
2002-10-14, Tartuffe, F.W. Murnau, 1926, 53,
2002-10-13, Roger Dodger, Dylan Kidd, 2002, 71,, 2002
2002-10-12, Lady Windermere's Fan, Ernst Lubitsch, 1925, 79,
2002-10-11, Das Experiment, Oliver Hirschbiegel, 2001, 57,, 2002
2002-10-10, Lost in La Mancha, Keith Fulton & Louis Pepe, 2002, 55,
2002-10-09, Greed, Erich von Stroheim, 1925, 94,
2002-10-07, I Am Trying to Break Your Heart, Sam Jones, 2002, 55,, 2002
2002-10-05, The Phantom of the Opera, Rupert Julian, 1925, 62,
2002-10-04, Moonlight Mile, Brad Silberling, 2002, 55,, 2002
2002-10-02, Sally of the Sawdust, D.W. Griffith, 1925, 60,
2002-10-01, Ivan, Alexander Dovzhenko, 1932, 57,
2002-09-30, The Extraordinary Adventures of Mr. West in the Land of the Bolsheviks, Lev Kuleshov, 1924, 50,
2002-09-29, The House of Darkness, D.W. Griffith, 1913, 58,
2002-09-29, My Big Fat Greek Wedding, Joel Zwick, 2002, 26,, 2002
2002-09-29, America, D.W. Griffith, 1924, 48,
2002-09-27, 24 Hour Party People, Michael Winterbottom, 2002, 69,, 2002
2002-09-25, For His Son, D.W. Griffith, 1912, 63, s
2002-09-25, What Shall We Do With Our Old?, D.W. Griffith, 1911, 60, s
2002-09-25, In the Border States, D.W. Griffith, 1910, 63, s
2002-09-25, The Redman's View, D.W. Griffith, 1909, 61, s
2002-09-22, The Great Ecstasy of the Woodcarver Steiner, Werner Herzog, 1974, 65, s
2002-09-22, How Much Wood Would a Woodchuck Chuck..., Werner Herzog, 1976, 57, s
2002-09-20, Igby Goes Down, Burr Steers, 2002, 36,, 2002
2002-09-18, Standing By Yourself, Josh Koury, 2001, 52,, 2002
2002-09-18, Kalkitos, Miguel Gomes, 2002, 24, s
2002-09-18, Gentle-Man, Sean Reynard, Tom Meeten, 2002, 51, s
2002-09-18, P.I.F., Sean Reynard, Tom Meeten, 2002, 40, s
2002-09-18, The Free Man, Sylvie Boisseau & Frank Westermeyer, 2002, 25, s
2002-09-17, The Big Parade, King Vidor, 1925, 77,
2002-09-15, Read My Lips, Jacques Audiard, 2001, 69,, 2002
2002-09-15, Diplomatic Pouch, Alexander Dovzhenko, 1927, 40,
2002-09-15, Love's Berries, Alexander Dovzhenko, 1926, 39, s
2002-09-14, Stealing Harvard, Bruce McCulloch, 2002, 17,, 2002
2002-09-13, One Hour Photo, Mark Romanek, 2002, 48,, 2002
2002-09-11, Go West, Buster Keaton, 1925, 68,
2002-09-10, Arsenal, Alexander Dovzhenko, 1928, 59,
2002-09-09, Tumbleweeds, King Baggot, 1925, 56,
2002-09-08, Blue Crush, John Stockwell, 2002, 50,, 2002
2002-09-07, Session 9, Brad Anderson, 2001, 69,, 2001
2002-09-07, Isn't Life Wonderful, D.W. Griffith, 1924, 64, s
2002-09-06, The Uninvited, Lewis Allen, 1944, 63,
2002-09-05, No Such Thing, Hal Hartley, 2001, 76,, 2002
2002-09-04, Chess Fever, V.I. Pudovkin & Nikolai Shpikovsky, 1925, 37, s
2002-09-04, At 3:25, René Clair, 1925, 61, s
2002-09-03, The Joyless Street, G.W. Pabst, 1925, 56,
2002-08-31, Possession, Neil LaBute, 2002, 51,, 2002
2002-08-31, Strike, Sergei Eisenstein, 1925, 65,
2002-08-26, Seven Chances, Buster Keaton, 1925, 88,
2002-08-25, The Navigator, Donald Crisp & Buster Keaton, 1924, 77,
2002-08-25, The Good Girl, Miguel Arteta, 2002, 43,, 2002
2002-08-24, CQ, Roman Coppola, 2001, 68,, 2002
2002-08-23, Metropolis, Fritz Lang, 1927, 84,
2002-08-21, Austin Powers in Goldmember, Jay Roach, 2002, 49,, 2002
2002-08-17, The Kid Stays in the Picture, Nanette Burstein & Brett Morgen, 2002, 70,, 2002
2002-08-17, The Last Laugh, F.W. Murnau, 1924, 76,
2002-08-17, Murderous Maids, Jean-Pierre Denis, 2000, 60,, 2002
2002-08-16, Late Marriage, Dover Koshashvili, 2001, 87,, 2002
2002-08-14, Entr'acte, René Clair, 1924, 56, s
2002-08-12, The City of Lost Souls, Takashi Miike, 2000, 69,, 2002
2002-08-12, Aelita: Queen of Mars, Yakov Protazanov, 1924, 47,
2002-08-11, The Changeling, Peter Medak, 1980, 53,
2002-08-08, Kino-Eye, Dziga Vertov, 1924, 57,
2002-08-05, Kriemhild's Revenge, Fritz Lang, 1924, 63,
2002-08-04, Dead or Alive, Takashi Miike, 1999, 72,, 2001
2002-08-04, Full Frontal, Steven Soderbergh, 2002, 54,, 2002
2002-08-03, Six in Paris, Claude Chabrol & Jean Douchet & Jean-Luc Godard & Jean-Daniel Pollet & Eric Rohmer & Jean Rouch, 1965, 54,
2002-08-03, Sherlock, Jr., Buster Keaton, 1924, 94,
2002-08-02, Signs, M. Night Shyamalan, 2002, 53,, 2002
2002-08-01, Siegfried, Fritz Lang, 1924, 58,
2002-07-31, Cutter's Way, Ivan Passer, 1981, 76,
2002-07-28, The Marriage Circle, Ernst Lubitsch, 1924, 67,
2002-07-28, Atanarjuat: The Fast Runner, Zacharias Kunuk, 2001, 62,, 2002
2002-07-27, Trouble Every Day, Claire Denis, 2001, 70,, 2002
2002-07-25, Our Hospitality, Buster Keaton, John G. Blystone, 1923, 95,
2002-07-24, A Woman of Paris, Charles Chaplin, 1923, 79,
2002-07-22, California Split, Robert Altman, 1974, 66,
2002-07-20, The Three Ages, Buster Keaton, Eddie Cline, 1923, 58,
2002-07-19, Lovely & Amazing, Nicole Holofcener, 2001, 67,, 2002
2002-07-18, The Piano Teacher, Michael Haneke, 2001, 71,, 2002
2002-07-15, Kiss Me, Stupid, Billy Wilder, 1964, 78,
2002-07-14, Road to Perdition, Sam Mendes, 2002, 64,, 2002
2002-07-10, Safety Last, Fred C. Newmeyer, Sam Taylor, 1923, 81,
2002-07-08, The Red and the White, Miklós Jancsó, 1967, 80,
2002-07-07, The Believer, Henry Bean, 2001, 57,, 2002
2002-07-07, The Hunchback of Notre Dame, Wallace Worsley, 1923, 54,
2002-07-05, Uzumaki, Higuchinsky, 2000, 62,, 2002
2002-07-04, Orange County, Jake Kasdan, 2002, 41,, 2002
2002-07-04, The Nightingale's Voice, Wladyslaw Starewicz, 1923, 53, s
2002-07-04, The Frogs Who Wanted a King, Wladyslaw Starewicz, 1923, 52, s
2002-07-04, Time Out, Laurent Cantet, 2001, 81,, 2002
2002-07-04, The Love Nest, Eddie Cline & Buster Keaton, 1923, 66, s
2002-07-03, The Pilgrim, Charles Chaplin, 1923, 55, s
2002-07-02, The Balloonatic, Eddie Cline & Buster Keaton, 1923, 67, s
2002-07-02, Day Dreams, Eddie Cline & Buster Keaton, 1922, 58, s
2002-07-01, Bigger Than Life, Nicholas Ray, 1956, 67,
2002-07-01, The Electric House, Eddie Cline & Buster Keaton, 1922, 60, s
2002-06-30, The Lady and the Duke, Eric Rohmer, 2001, 70,, 2002
2002-06-30, Häxan, Benjamin Christensen, 1922, 69,
2002-06-26, Ring, Hideo Nakata, 1998, 66,
2002-06-24, The Frozen North, Eddie Cline & Buster Keaton, 1922, 59, s
2002-06-23, The Blacksmith, Buster Keaton & Mal St. Clair, 1922, 57, s
2002-06-21, Minority Report, Steven Spielberg, 2002, 58,, 2002
2002-06-20, Nanook of the North, Robert Flaherty, 1922, 84,
2002-06-19, My Wife's Relations, Eddie Cline & Buster Keaton, 1922, 63, s
2002-06-18, The Bourne Identity, Doug Liman, 2002, 51,, 2002
2002-06-17, The Hidden Fortress, Akira Kurosawa, 1958, 65,
2002-06-16, Dr. Mabuse, the Gambler, Fritz Lang, 1922, 67,
2002-06-10, Comanche Station, Budd Boetticher, 1960, 54,
2002-06-10, Ride Lonesome, Budd Boetticher, 1959, 55,
2002-06-09, Pay Day, Charles Chaplin, 1922, 72, s
2002-06-09, Cops, Eddie Cline & Buster Keaton, 1922, 75, s
2002-06-09, The Paleface, Eddie Cline & Buster Keaton, 1922, 66, s
2002-06-08, From Hell, The Hughes Brothers, 2001, 44,, 2001
2002-06-08, Undercover Brother, Malcolm D. Lee, 2002, 49,, 2002
2002-06-08, Foolish Wives, Erich von Stroheim, 1922, 88,
2002-06-03, Will Success Spoil Rock Hunter?, Frank Tashlin, 1957, 71,
2002-06-03, The Girl Can't Help It, Frank Tashlin, 1956, 70,
2002-06-02, Dogtown and Z-Boys, Stacy Peralta, 2001, 67,, 2002
2002-05-31, Orphans of the Storm, D.W. Griffith, 1921, 65,
2002-05-30, The Idle Class, Charles Chaplin, 1921, 53, s
2002-05-28, The Boat, Eddie Cline & Buster Keaton, 1921, 66, s
2002-05-28, The Playhouse, Eddie Cline & Buster Keaton, 1921, 63, s
2002-05-28, The Goat, Buster Keaton & Mal St. Clair, 1921, 70, s
2002-05-28, The High Sign, Eddie Cline & Buster Keaton, 1921, 89, s
2002-05-27, Lagaan: Once Upon a Time in India, Ashutosh Gowariker, 2001, 58,, 2002
2002-05-27, Insomnia, Christopher Nolan, 2002, 54,, 2002
2002-05-26, Hard Luck, Eddie Cline & Buster Keaton, 1921, 61, s
2002-05-25, About a Boy, Paul Weitz & Chris Weitz, 2002, 38,, 2002
2002-05-23, The Haunted House, Eddie Cline & Buster Keaton, 1921, 68, s
2002-05-23, The Phantom Chariot, Victor Sjöström, 1921, 64,
2002-05-22, Black Tight Killers, Yasuharu Hasebe, 1966, 49,
2002-05-21, Leaves From Satan's Book, Carl Theodor Dreyer, 1920, 60,
2002-05-19, Neighbors, Eddie Cline & Buster Keaton, 1920, 63, s
2002-05-18, Pulse, Kiyoshi Kurosawa, 2001, 72,
2002-05-18, The Son's Room, Nanni Moretti, 2001, 77,, 2002
2002-05-17, The Scarecrow, Eddie Cline & Buster Keaton, 1920, 68, s
2002-05-15, Convict 13, Eddie Cline & Buster Keaton, 1920, 67, s
2002-05-14, The Saphead, Herbert Blaché & Winchell Smith, 1920, 44
2002-05-13, Way Down East, D.W. Griffith, 1920, 50,
2002-05-12, Unfaithful, Adrian Lyne, 2002, 51,, 2002
2002-05-11, Sabrina, Billy Wilder, 1954, 64,
2002-05-11, One Week, Eddie Cline & Buster Keaton, 1920, 90, s
2002-05-06, A Dog's Life, Charles Chaplin, 1918, 67, s
2002-05-05, Male and Female, Cecil B. DeMille, 1919, 62,
2002-05-05, Spider-Man, Sam Raimi, 2002, 64,, 2002
2002-05-01, A Day's Pleasure, Charles Chaplin, 1919, 63, s
2002-05-01, The Monastary of Sendomir, Victor Sjöström, 1920, 49,
2002-04-30, What Time Is It There?, Tsai Ming-liang, 2001, 79,, 2002
2002-04-28, The Garage, Roscoe Arbuckle, 1919, 50, s
2002-04-28, The Hayseed, Roscoe Arbuckle, 1919, 55, s
2002-04-28, Back Stage, Roscoe Arbuckle, 1919, 65, s
2002-04-27, Destiny, Fritz Lang, 1921, 60,
2002-04-27, Sunnyside, Charles Chaplin, 1919, 60, s
2002-04-27, Shoulder Arms, Charles Chaplin, 1918, 65, s
2002-04-25, The Cheat, Cecil B. DeMille, 1915, 62,
2002-04-25, Monsoon Wedding, Mira Nair, 2001, 62,, 2002
2002-04-23, Flesh and the Devil, Clarence Brown, 1926, 62,
2002-04-23, Thomas Graal's Best Child, Mauritz Stiller, 1918, 60,
2002-04-22, The Dream, Thomas Ince & George Loane Tucker, 1911, 55,
2002-04-21, Judith of Bethulia, D.W. Griffith, 1914, 63,
2002-04-20, An Aria on Gaze, Hisayasu Sato, 1992, 50,
2002-04-20, Visitor Q, Takashi Miike, 2001, 66,
2002-04-16, It, Clarence G. Badger, 1927, 63,
2002-04-13, Frailty, Bill Paxton, 2002, 39,, 2002
2002-04-12, Human Nature, Michel Gondry, 2001, 59,, 2002
2002-04-12, The Outlaw and His Wife, Victor Sjöström, 1918, 87,
2002-04-07, The Brother From Another Planet, John Sayles, 1984, 68,
2002-04-06, Following, Christopher Nolan, 1998, 63,
2002-04-05, Y tu mamá también, Alfonso Cuarón, 2001, 78,, 2002
2002-03-30, Blade II, Guillermo del Toro, 2002, 58,, 2002
2002-03-29, Panic Room, David Fincher, 2002, 64,, 2002
2002-03-28, E.T. The Extra-Terrestrial, Steven Spielberg, 1982, 75,
2002-03-24, Scratch, Doug Pray, 2001, 66,, 2002, , 2002
2002-03-24, No Man's Land, Danis Tanovic, 2001, 67,, 2001
2002-03-23, Brotherhood of the Wolf, Christophe Gans, 2001, 57,, 2002
2002-03-16, Zoolander, Ben Stiller, 2001, 49,, 2001
2002-03-15, The Last Waltz, Martin Scorsese, 1978, 68,
2002-03-14, Kandahar, Mohsen Makhmalbaf, 2001, 62,, 2001
2002-03-12, Hell House, George Ratliff, 2001, 64,, 2002
2002-03-09, Home Movie, Chris Smith, 2001, 57,, 2002
2002-03-08, Tuvalu, Veit Helmer, 1999, 57,, 2001
2002-03-04, Metropolis, Rintaro, 2001, 62,, 2002
2002-03-02, The Count of Monte Cristo, Kevin Reynolds, 2002, 39,, 2002
2002-02-26, Dinner at Eight, George Cukor, 1933, 65,
2002-02-24, Matinée, Jaime Humberto Hermosillo, 1977, 64,
2002-02-21, Wisconsin Death Trip, James Marsh, 1999, 63,
2002-02-20, Female Convict 'Scorpion'--Jailhouse 41, Shunya Ito, 1972, 57,
2002-02-19, Trouble in Paradise, Ernst Lubitsch, 1932, 97,
2002-02-16, The Mothman Prophecies, Mark Pellington, 2002, 52,, 2002
2002-02-10, Monster's Ball, Marc Forster, 2001, 58,, 2001
2002-02-09, Storytelling, Todd Solondz, 2001, 52,, 2002
2002-02-05, My Man Godfrey, Gregory La Cava, 1936, 73,
2002-02-02, Birthday Girl, Jez Butterworth, 2000, 42,, 2002
2002-02-02, 101 Reykjavik, Baltasar Kormákur, 2000, 61,, 2001
2002-01-29, You Can't Take It With You, Frank Capra, 1938, 61,
2002-01-27, Lantana, Ray Lawrence, 2001, 54,, 2001
2002-01-26, Voyages, Emmanuel Finkiel, 1999, 56,, 2001
2002-01-26, Black Hawk Down, Ridley Scott, 2001, 58,, 2001
2002-01-20, 2001: A Space Odyssey, Stanley Kubrick, 1968, 100,
2002-01-18, Southern Comfort, Kate Davis, 2001, 66,, 2001
2002-01-17, Little Otik, Jan Svankmajer, 2000, 70,, 2001
2002-01-16, Intimacy, Patrice Chéreau, 2000, 63,, 2001
2002-01-15, Faust, F.W. Murnau, 1926, 66,
2002-01-12, Gosford Park, Robert Altman, 2001, 66,, 2001
2002-01-11, Chain Camera, Kirby Dick, 2001, 66,, 2001
2002-01-05, Ali, Michael Mann, 2001, 71,, 2001
2002-01-04, The Legend of Rita, Volker Schlöndorff, 1999, 61,, 2001
2002-01-01, A Beautiful Mind, Ron Howard, 2001, 28,, 2001
